t2 de luxo em empreendimento novo a 5 minutos do hospital de s.joao;151.000 €;apartamento de luxoCozinha – Parede do balcão em material do tipo “Silestone”,totalmente equipadas complaca, forno, microondas, exaustor, máq.lavar-louça e combinado.(Electrodomésticos tipo “Bosch”)Quartos, Sala, Halls e Despensas - Estanhadas e pintura. Inst. Sanitárias- Rectificados tipo “Porcelanosa”quartos de banho com Louça suspensa, brancas com aplicação de torneirasmonocomando, móveis de lavatório e espelho. Lavandaria - Azulejo tipo “Cinca” 20x20Salas, Quartos e corredores - Madeira exótica com acabamento sucupiraou carvalhoAquecimento central, estores eletricos, video porteiro,garagem com 19m2sala de condominiovisite...;A+;http://www.remax.pt/Condo-Apartment-For-Sale-Pedroucos-Maia_122071062-136;41.531742;-8.617892;2;;;107,00;2013;100;2;3;;;;
Moradia V4 de luxo em Ferragudo. Certf. Energt. A+ Excelente investimento. ;349.000 €;Estas 2 últimas moradias estão à venda com excelente preço. Tem acabamentos de luxo, 4 quartos, sala comum, cozinha equipada com equipamentos A+, 3 casas de banho de luxo, garagem para vários carros, BBQ, piscina privativa e jardim.Este pode ser a casa dos seus sonhos! Venha visitar. Obg teste;A+;http://www.remax.pt/Two-Family-House-For-Sale-Ferragudo-Lagoa_122261118-153;37.128226;-8.512045;4;;;282,00;2014;224;3;5;;;;
Apartamento T3 ;105.000 €;Apartamento T3 construção nova com boas soluções de acabamentos Prédio com apenas quatro frações, equipado com instalação para gás natural. Possui painéis solares para águas sanitárias, pré-instalação de aquecimento central através de recuperador de calor.Apartamento ao nível do primeiro andar: cozinha com caldeira para aquecimento central e águas sanitárias.Os quartos possuem roupeiro, sala com lareira, duas casas de banho, uma com banheira e outra com poliban. no hall de acesso aos quartos dispõe ainda de um roupeiro.Habitação com classe energética A+, aspiração central e estores elétricos.Garagem fechada com portão automático, capacidade para três...;A+;http://www.remax.pt/Condo-Apartment-For-Sale-Alcafache-Mangualde_122461057-252;40.59157;-7.842414;3;;1;130,00;2012;130;1;4;;;;
t1 novo empreendimento Belo Horizonte;120.000 €;T1 de Luxo com construção de 1ª qualidadeAcabamentos de luxoExcelentes áreasSuite Receção montada para eventuais visitas ou ate reunioes de condominio, num conforto unicoLigue me para eventuais esclarecimentos e visitas;A+;http://www.remax.pt/Condo-Apartment-For-Sale-Pedroucos-Maia_122071062-132;41.551676;-8.596996;1;;;96,00;2011;80;;2;;;;
t1 condominio Belo horizonte a 5 minutos do hospital de s.joao;114.000 €;Vídeo Porteiro • Instalação de Rede de Gás • Instalação preparada para TV Cabo • Aquecimento Central (Caldeiras e Radiadores) • Banheira de Hidromassagem • Móveis de Lavatório com Espelho • Garagem Fechada • Cozinhas com Placa, Forno, Exaustor, Combinado e Máquina de Lavar Louça • Pontos de Ligação de TV na Cozinha, Sala e Quartos • Estores Eléctricos • Portas de Entrada Blindadas • Som Ambiente Completo • Aspiração Central CompletaProximo de comercio e serviços, saida de cidade, hipermercadoVisite ja;A+;http://www.remax.pt/Condo-Apartment-For-Sale-Pedroucos-Maia_122071062-130;41.531742;-8.617892;1;;;92,00;2014;75;;2;;;;
* HÁ COISAS FANTÁSTICAS, NÃO HÁ!? *;450.000 €;  Beleza e requinte, aliados a um altíssimo padrão de qualidade, é o que lhe vai encantar nesta esplêndida moradia TERREA, de linha contemporânea, inserida numa zona estrategicamente escolhida: Entre o campo e o mar!---------------------------------------------------------------------------------------------------* O valor anunciado contempla a entrega do imóvel chave na mão:PISCINA COM CASA DE APOIO E WC,DECK A VOLTA DA PISCINA,JARDIM COMPLETO COM REGA AUTOMÁTICA,FURO DE ÁGUA PARA SERVIR A PISCINA E A REGA,ILUMINAÇÃO EXTERIOR INCLUSIVE NOS MUROS,PORTÕES DE ACESSO AO TERRENO E A GARAGEM AUTOMATIZADOS,ZONA DE...;A+;http://www.remax.pt/Two-Family-House-For-Sale-Mafra-Mafra_121011135-293;38.966512;-9.358677;4;;5;990,00;2013;285;;5;;;;
Luxuoso Apart. T3 em construção em frente Mar;715.000 €;  (Bloco B) Apartamento T3 em construção em frente ao mar com acabamentos de Luxo. Localizado numa zona nobre e totalmente requalificada de Vila Nova de Gaia, no entanto próximo do centro urbano. Com uma visão moderna e futurista, concilia as mais recentes técnicas de construção com o conforto e eficiência energética, sem nunca esquecer a segurança e a funcionalidade. Sem descurar o lazer e o bem estar, este apartamento está inserido num edifício com piscina interior aquecida, jacuzzi e banho turco. Tem ainda uma envolvente de espaços ajardinados aonde poderá usufruir do ar puro, da brisa do mar e do sol. ;A+;http://www.remax.pt/Condo-Apartment-For-Sale-Canidelo-Vila-Nova-de-Gaia_123571055-41;41.128601;-8.666775;3;;;313,00;2015;313;3;4;;;;
T3+1 de Luxo;560.000 €;Excelente apartamento de luxo em pleno centro da Solum a 2 min a pé do Estádio Ciadade de Coimbra.Acabamentos de altissima qualidade.Excelente exposição solarVisite;A+;http://www.remax.pt/Condo-Apartment-For-Sale-Santo-Antonio-dos-Olivais-Coimbra_123351019-278;40.204247;-8.401752;3;;1;420,00;2011;250;2;4;4º Andar;;4;
T2 com terraço no empreendimento Monte Penedo;154.000 €;Excelente apartamento t2 com acabamentos topo de gamaDomoticaestores eletricoscozinhas personalizadaspavimentos em madeira de alta qualidadesuitebox para viatura;A+;http://www.remax.pt/Condo-Apartment-For-Sale-Milheiros-Maia_122071062-139;;;2;;;184,00;2012;110;;3;;;;
T2 com ampla varanda no edificio Monte Penedo;154.000 €;Construçao da mais alta qualidade com acabamentos topo de gamabox para 2 viaturasareas amplaspossibilidade de personalizar areasligue me para visitar;A+;http://www.remax.pt/Condo-Apartment-For-Sale-Milheiros-Maia_122071062-138;41.531742;-8.617892;2;;;175,00;2013;116;;3;;;;
APARTAMENTO NOVO - URBANIZAÇÃO UNIVERSITAS;140.000 €;Apartamento T3 novo  de arquitectura moderna inserido em zona tranquila a curta distância da Universidade do Minho, do Centro Nanotecnologia e do Hospital de Braga com ótimas acessibilidade.Fachadas ventiladas e um excelente isolamento térmico e acústico.Rede interna de fibra óptica, aquecimento central (caldeira gás natural), painéis solares, aspiração central, lavandaria e garagem individual.Cozinha equipada com eletrodomésticos.;A+;http://www.remax.pt/Condo-Apartment-For-Sale-Gualtar-Braga_123331027-27;41.570406;-8.385047;3;;;157,00;2013;141;;4;1º Andar;;;
T1 C/ CONDIÇÕES ESPECIAS DE FINANCIAMENTO - Aveiro Centro ;112.500 €;CONDIÇÕES ESPECIAIS DE FINANCIAMENTO POSSIBILIDADE DE FINANCIAMENTO ATÉ 100%Apartamento Novo T1 localizado na Alameda de Aveiro Este apartamento é constituído por Hall, 1 sala, cozinha, lavandaria, 1 quarto, 1 casa de banho, arrumos, varanda e garagem para 1 carro.  AS FOTOGRAFIAS APRESENTADAS SÃO CORRESPONDENTES AO ANDAR MODELO ;A+;http://www.remax.pt/Condo-Apartment-For-Sale-Vera-Cruz-Aveiro_123421026-55;40.640465;-8.637249;1;;;96,00;2013;64;1;2;3º Andar;;;
Apartamento Novo com Financiamento a 100%!;210.000 €;Apartamentos com excelentes áreas e alta qualidade de construção, em prédio de arquitectura moderna, situado na Nova Azeda, em Setúbal.Fáceis acessos à A1 e a zonas comerciais, a 2 minutos do futuro Centro Comercial Alegro de Setúbal.Condições especiais de financiamento a 100%! Pormenores Técnicos: - Caixilharia em alumínio lacado á côr natural c/rotura térmica e vidro duplo,- Estores das janelas em alumínio termolacado e das varandas e terraço, com estoresBrisa, com comando eléctrico,- Pré-instalação de ar condicionado em todas as divisões, incluindo na cozinha,- Aquecimento de águas sanitárias através de painéis solares individuais com  depósito...;A+;http://www.remax.pt/Condo-Apartment-For-Sale-Setubal-(Sao-Sebastiao)-Setubal_123411019-95;38.542002;-8.877372;3;;;;2012;150;;4;5º Andar;;;
EXCELENTE MORADIA COMO NOVA;350.000 €;Moradia como nova, foi habitada durante um ano. Ar condicionado em todas as divisões, aquecimento central eléctrico. Painéis solares, Estores eléctricos, Aspiração central e som ambiente em todas as divisões incluindo casas de banho. Alarme sectorial e video no 1º andar e R/C. Porta de segurança. Ampla zona com churrasqueira e zona de estacionamento junto à garagem.Lote de 330 m2 todo em calçada.;A+;http://www.remax.pt/Two-Family-House-For-Sale-Santa-Iria-de-Azoia-Loures_120881082-208;;;3;;;320,00;2012;215;3;5;;;;
Apartamento Novo com Financiamento a 100%;220.000 €;Apartamentos com excelentes áreas e alta qualidade de construção, em prédio de arquitectura moderna, situado na Nova Azeda, em Setúbal.Fáceis acessos á A1 e a zonas comerciais, a 2 minutos do futuro Centro Comercial Alegro de Setúbal.Condições especiais de financiamento a 100%! Pormenores Técnicos: - Caixilharia em alumínio lacado á côr natural c/rotura térmica e vidro duplo,- Estores das janelas em alumínio termolacado e das varandas e terraço, com estoresBrisa, com comando eléctrico,- Pré-instalação de ar condicionado em todas as divisões, incluindo na cozinha,- Aquecimento de águas sanitárias através de painéis solares individuais com  depósito...;A+;http://www.remax.pt/Condo-Apartment-For-Sale-Setubal-(Sao-Sebastiao)-Setubal_123411019-92;38.542027;-8.877377;3;;;340,00;2012;170;;4;3º Andar;;;
CONDOMÍNIO NOVO NAS AVENIDAS NOVAS;533.000 €;  Luxo de viver em qualidade no Centro de Lisboa.LB 21 é um condomínio exclusivo com jardim e piscina em plena zona das Avenidas Novas.Habitar neste empreendimento é tirar o máximo partido de tudo o que a cidade tem de bom.Envolvente rica em comércio, serviços (El Corte Inglês), espaços verdes (Parque Eduardo VII), espaços culturais (Fundação Calouste Gulbenkian) e próximo de uma excelente rede de transportes (Metro São Sebastião).12 apartamentos únicos, tipologias T1, T2, T3 e T3 Duplex,  acabamentos de elevada qualidade e Design com pormenores que marcam a diferença -  Projecto de interiores da autoria do Atelier de Arquitectura e Design de Nini Andrade...;A+;http://www.remax.pt/Condo-Apartment-For-Sale-Nossa-Senhora-de-Fatima-Lisbon_120181028-2177;38.732799;-9.15063;2;;;;2014;106;2;3;5º Andar;;;
Moradia T6 em Tires;380.000 €;Moradia situada em Tires, S. Domingos de Rana, inserida em condomínio privadoTem garagem com lugar para 3 carros, vidros duplos, ar condicionado, porta blindada, 3 quartos com varanda, um dos quais suite com closet, cozinha equipada e com despensa e lavandaria, 2 casas de banho, 1 WC social.Cave com sala e escritório.;A+;http://www.remax.pt/Two-Family-House-For-Sale-Sao-Domingos-de-Rana-Cascais_121831157-21;;;4;;1;286,00;2011;189;2;6;;189,00;;
Apartamento Novo com Financiamento a 100%!;220.000 €;Apartamentos com excelentes áreas e alta qualidade de construção, em prédio de arquitectura moderna, situado na Nova Azeda, em Setúbal.Fáceis acessos á A1 e a zonas comerciais, a 2 minutos do futuro Centro Comercial Alegro de Setúbal.Condições especiais de financiamento a 100%! Pormenores Técnicos: - Caixilharia em alumínio lacado á côr natural c/rotura térmica e vidro duplo,- Estores das janelas em alumínio termolacado e das varandas e terraço, com estoresBrisa, com comando eléctrico,- Pré-instalação de ar condicionado em todas as divisões, incluindo na cozinha,- Aquecimento de águas sanitárias através de painéis solares individuais com  depósito...;A+;http://www.remax.pt/Condo-Apartment-For-Sale-Setubal-(Sao-Sebastiao)-Setubal_123411019-96;38.542042;-8.877374;3;;;;2012;170;;4;5º Andar;;;
QUINTA DO AGRELO;790.000 €;  A 15 KMS DO CENTRO DE PONTE DE LIMA, SITUA-SE A QUINTA DO AGRELO COM CARACTERÍSTICAS ÚNICAS E DESLUMBRANTES, ENVOLVIDA NUM AMBIENTE TRANQUILO E VERDEJANTE.NA QUINTA DESFRUTA DE UMA CASA PRINCIPAL COM 520M², EM PEDRA, TELHADOS REVESTIDOS EM COBRE, LOCAL DE CONFORTO, REQUINTE E QUALIDADE, CASA DE HÓSPEDES, CAMPO DE PADELL, PISCINA ÁGUA SALGADA AQUECIDA, CHURRASQUEIRA, MICRO PRODUÇÃO DE ENERGIA SOLAR QUE GARANTE A AUTOSUSTENTABILIDADE ELÉCTRICA DA CASA, ÁGUA DE FURO ARTESIANO, POÇO E MINA COM DEPÓSITO AUTÓNOMO E SISTEMA DE BOMBAGEM INDUSTRIAL, SISTEMA DE REGA AUTOMÁTICO, REDE DE REGA EM TODA A PROPRIEDADE, VINHA EM PLENA PRODUÇÃO, HORTA, TRINTA OLIVEIRAS ANTIGAS, ÁGUA QUENTE SANITÁRIA...;A+;http://www.remax.pt/Farm-For-Sale-Navio-Ponte-de-Lima_123821002-410;41.624959;-8.632127;7;;1;20.000,00;2003;520;4;7;;;;
Apartamento Novo com Financiamento a 100%!;220.000 €;Apartamentos com excelentes áreas e alta qualidade de construção, em prédio de arquitectura moderna, situado na Nova Azeda, em Setúbal.Fáceis acessos á A1 e a zonas comerciais, a 2 minutos do futuro Centro Comercial Alegro de Setúbal.Condições especiais de financiamento a 100%! Pormenores Técnicos: - Caixilharia em alumínio lacado á côr natural c/rotura térmica e vidro duplo,- Estores das janelas em alumínio termolacado e das varandas e terraço, com estoresBrisa, com comando eléctrico,- Pré-instalação de ar condicionado em todas as divisões, incluindo na cozinha,- Aquecimento de águas sanitárias através de painéis solares individuais com  depósito...;A+;http://www.remax.pt/Condo-Apartment-For-Sale-Setubal-(Sao-Sebastiao)-Setubal_123411019-94;38.542044;-8.877345;3;;;;2012;170;;4;4º Andar;;;
;165.000 €;APARTAMENTO DE QUALIDADE SUPERIOR COM CERTIFICAÇÃO ENERGÉTICA CLASSE A+. Com excelentes áreas e localização privilegiada. Dispõe de cozinha totalmente equipada com electrodomésticos de encastrar , ar condicionado,  e aspiração central em todas as divisões: detecção de inundação, detecção de incêndio, detecção de intruso e controlo de estores. Dispõe também de painéis solares para aquecimento de águas sanitárias. Casas de banho com mobiliário exclusivo, loiças sanitárias suspensas e hidromassagem. Possui ainda janelas e portas para o exterior em madeira/ alumínio com corte térmico, estores térmicos e eléctricos, portas interiores e roupeiros em madeira de cerejeira, pavimento Flutuante, e...;A+;http://www.remax.pt/Condo-Apartment-For-Sale-Loures-Loures_122841168-25;40.291409;-7.434483;2;;1;624,00;2011;100;1;3;R/C;;;
NOVO - MORADIA DE SONHO EM HARMONIA COM A NATUREZA;680.000 €;  Fantástica moradia inserida no empreendimento Quinta de São Sebastião, no topo da Vila de Barcarena, com excelente vista de campo e mar! Áreas amplas e layout interno moderno e funcional, eficiência energética A+, construção de elevada qualidade e cuidada seleção de acabamentos e equipamentos. Cozinha totalmente equipada. Aspiração central e alarme volumétrico contra intrusão. Ar condicionado Mitsubishi. Painéis solares Vulcano (águas quentes). Estacionamento privativo para 3 automóveisProximidade de importantes eixos rodoviários e a poucos minutos de áreas...;A+;http://www.remax.pt/Two-Family-House-For-Sale-Barcarena-Oeiras_120181138-243;38.719944;-9.269496;5;;1;418,00;2008;334;4;7;;;3;
T3 NOVO COM OPTIMOS ACABAMENTOS ::BAIXA DE PREÇO::;99.000 €;Situado numa zona muitíssimo calma encontramos este fantástico apartamento que reúne um conjunto de pormenores que o tornam unico:- Pré instalação Ar condicionado- Domotica- Painéis Solares- Alarme-Arrecadação- Estores eletricos- Cozinha completamente equipada- HidromassagemVENHA CONHECER ESTA FANTÁSTICA OPORTUNIDADE...;A+;http://www.remax.pt/Condo-Apartment-For-Sale-Samora-Correia-Benavente_121981024-326;;;3;;;260,00;2010;110;2;4;1º Andar;;;
Exelente Oportunidade;145.000 €;Apartamento T2 em condomínio com piscina, a 20 metros de distancia da Meia Praia.Mobilado.;A+;http://www.remax.pt/Condo-Apartment-For-Sale-Lagos-(Sao-Sebastiao)-Lagos_121601101-5;;;2;;;1.450,00;1999;95;1;3;1º Andar;95,00;2;
T1 COM CONDIÇÕES ESPECIAIS DE FINANCIAMENTO;112.500 €;CONDIÇÕES ESPECIAIS DE FINANCIAMENTOPOSSIBILIDADE DE FINANCIAMENTO ATÉ 100%Apartamento novo T1, localizado na Alameda de Aveiro.Este apartamento é constituído por sala, cozinha, hall, um quarto, lavandaria, varanda, garagem.AS FOTOGRAFIAS APRESENTADAS, CORRESPONDEM AO ANDAR MODELO.;A+;http://www.remax.pt/Condo-Apartment-For-Sale-Vera-Cruz-Aveiro_123421030-46;40.640351;-8.637228;1;;;94,00;2013;64;;2;3º Andar;94,00;;
Excelentes acabamentos!;500.000 €;Moradia Isolada, localizada em urbanização recente, perto dos acessos à A33 e A2.Acabamentos de elevadíssima qualidade, podendo se destacar alguns pormenores com:- Salamandra a pallets para aquecimento de piso radiante hidráulico com ligação aos painéis solares fornecimento de água quente. - Reciclação de água quente.- Piso radiante em toda a casa.- Janelas em alumínio duplo, oscilo-batentes com vidro de 22mm.- Aspiração central.- Piscina de 8x3.5 de água salgada aquecida, com controlo automático de Ph e sal.- Sistema de rega automático.- Pré-instalação de sistema de video vigilância.- Pré-instalação de bomba de calor.- Pré-instalação de ar...;A+;http://www.remax.pt/Two-Family-House-For-Sale-Corroios-Seixal_122221110-208;;;5;;;370,00;2014;205;5;7;;;3;
«««« VENDIDO »»»»;725.000 €;  NOVO - MORADIA DE SONHO EM HARMONIA COM A NATUREZAFantástica moradia inserida no empreendimento Quinta de São Sebastião, no topo da Vila de Barcarena, com excelente vista de campo e mar! Áreas amplas e layout interno moderno e funcional, eficiência energética A+, construção de elevada qualidade e cuidada seleção de acabamentos e equipamentos. Cozinha totalmente equipada. Aspiração central e alarme volumétrico contra intrusão. Ar condicionado Mitsubishi. Painéis solares Vulcano (águas quentes). Estacionamento privativo para 3 automóveisProximidade de importantes eixos rodoviários e a poucos minutos de áreas comerciais, de infraestruturas desportivas e de lazer e a apenas 5...;A+;http://www.remax.pt/Two-Family-House-For-Sale-Barcarena-Oeiras_120181138-246;38.719933;-9.269425;6;;2;418,00;2008;350;4;7;;;3;
vista Alegre - Moradia T4 e sotão aproveitado ;295.000 €;Vista AlegreMoradia T4 como nova Cave com 76m2 e w.c de serviço , quintal com telheiro e churasqueira.R/ chão sala com 45m2 , w.c de serviço , cozinha equipada , sala de refeições , varanda fechada.1.º andar 4 quartos com roupeiros , 1 deles suite , roupeiro no all. sotão aproveitado com divisão ampla 2 janelas velux . Boas areas e bons acabamentos, aspiração centrar , pre instalação de aquecimento centrar , pre instalação de A.c.Zona de excelencia ;A+;http://www.remax.pt/Two-Family-House-For-Sale-Malagueira-Evora_120121064-631;;;4;;2;600,00;2008;299;1;5;;;2;
Luxuosa Moradia...;620.000 €;Grande oportunidade de adquirir uma moradia de charme. Áreas fabulosas e acabamentos de elevada qualidade, aliados a materiais únicos e harmoniosos.A moradia é dividida por 2 pisos e cave com 200 m2. Envolvida por um belo jardim e piscina refrescante. No piso térreo temos uma espaçosa sala e cozinha totalmente equipada (acesso a churrasqueira), escritório, garagem e 2 casas de banho de apoio. O piso superior é composto por 3 suites (com varanda). Uma com closet e a outra com um amplo terraço, para contemplar a vista sobre o jardim e piscina.A moradia é toda equipada com Ar Condicionado, Aspiração Central e Painéis Solares. Com Pré-instalação de Aquecimento...;A+;http://www.remax.pt/Two-Family-House-For-Sale-Castro-Marim-Castro-Marim_123371002-1130;37.176321;-7.487354;4;;1;1.576,00;2013;490;4;5;;;;
Moradia V4 de luxo em Ferragudo. Certf. Energt. A+ Excelente investimento. ;346.000 €;  Estas 2 últimas moradias estão à venda com excelente preço. Tem acabamentos de luxo, 4 quartos, sala comum, cozinha equipada com equipamentos A+, 3 casas de banho de luxo, garagem para vários carros, BBQ, piscina privativa e jardim.Este pode ser a casa dos seus sonhos! Venha visitar. ;A+;http://www.remax.pt/Two-Family-House-For-Sale-Ferragudo-Lagoa_122261135-164;37.123682;-8.521333;4;;;282,00;2014;224;3;5;;;;
APARTAMENTO NOVO - URBANIZAÇÃO UNIVERSITAS;135.000 €;Apartamento T3 novo  de arquitectura moderna inserido em zona tranquila a curta distância da Universidade do Minho, do Centro Nanotecnologia e do Hospital de Braga com ótimas acessibilidade.Fachadas ventiladas e um excelente isolamento térmico e acústico.Rede interna de fibra óptica, aquecimento central (caldeira gás natural), painéis solares, aspiração central, lavandaria e garagem individual.Cozinha equipada com eletrodomésticos.;A+;http://www.remax.pt/Condo-Apartment-For-Sale-Gualtar-Braga_123331027-26;41.570406;-8.385047;3;;;158,00;2013;135;;4;R/C;;;
VIVER NA FOZ;550.000 €;Nascido no encontro da Rua do Carvalho com a Rua Diogo Botelho que lhe dá o nome, o Edifício Foz Diogo Botelho beneficia de uma localização privilegiada em pleno Porto, a desaguar na Foz. Com zonas verdes à sua volta, espaços abundante, amplas vistas e todos os serviços e comodidades de uma zona que desde sempre tem vindo a fixar os mais exigentes portuenses.Localizado junto à Universidade Católica, são imediatas as ligações do Edifício tanto à Praça do Império e Foz, para um lado, como à Rua Diogo Botelho, Campo Alegre e VCI, pelo outro.;A+;http://www.remax.pt/Condo-Apartment-For-Sale-Foz-do-Douro-Oporto_123571053-183;41.152228;-8.654504;4;;;228,00;2012;220;;5;1º Andar;;;
t2 novo emprrendimento Santa Luzia;168.000 €;Apartamento t2 novo com excelentes areas e acabamentos de luxo SuiteWc completoSala com 30m2Pavimentos em sucupiraCozinha totalmente equipada BoschPossibilidade de acabamentos personalizados no apartamento;A+;http://www.remax.pt/Condo-Apartment-For-Sale-Paranhos-Oporto_122071062-147;;;2;;;138,00;2013;117;;3;;;;
Apartamentos NOVOS - Excelentes acabamentos;255.000 €;Fantásticos apartamentos Novos, a estrear em zona central e de referência, excelente localização, muita luminosidade, acabamentos de luxo.Materiais escolhidos com todo o detalhe e requinte. Vidros duplos com protecção térmica, estores elétricos de laminas de alumínio, pavimentos flutuante em Faia, painéis solares, aspiração central, alarme de tecnologia wireless, ar condicionado (solução por condutas).Cozinha totalmente equipada com eletrodomésticos SMEG.Quartos com roupeiro, Boas varandas, 2 lugares de parqueamento e arrecadação.Venha conhecer, óptimos preços! ;A+;http://www.remax.pt/Condo-Apartment-For-Sale-Parede-Cascais_122911113-71;38.689715;-9.356123;3;2;;162,00;2013;141;2;4;1º Andar;141,00;;
***PENTHOUSE COM EXCELENTES ACABAMENTOS***;308.000 €;  Localizado numa urbanização nova em Montenegro!Principais características:- Dois terraços e uma varanda,- Ar condicionado em todas as divisões incluindo cozinha,- Vidros duplos,- Persianas eléctrica,- Portas de correr nas zonas de acesso a sala e quartos,- Todos os quartos com roupeiros,- Duas suites,- Cozinha equipada,- Arrumação nos terraços,- Consola Domótica,- Acabamentos de Luxo.;A+;http://www.remax.pt/Penthouse-For-Sale-Montenegro-Faro_123561012-140;37.03149;-7.96468;4;;1;300,00;2011;300;3;5;3º Andar;;;
APARTAMENTO T2 NOVO VISTAS MAR ;179.000 €;Apartamento unico , novo com localização de excelência e vistas mar.Tem dois quartos , WC completo, cozinha mobilada, aquecimento central.Garagem fechada para um carro.Bons acabamentos.Venha conhecer!Marque já a sua visita!!MJ;A+;http://www.remax.pt/Condo-Apartment-For-Sale-Vila-do-Conde-Vila-do-Conde_123061050-188;41.365189;-8.760852;2;;;105,00;2014;105;1;3;1º Andar;;;
Fabuloso T3 Novo - Junto à Praia de S. João;290.000 €;O condomínio Villas São João situa-se em São João da Caparica, a 15 Km de Lisboa, a 1,5 km do campo de golfe dos Capuchos, a 10 km dos campos de golfe da Aroeira e a pouco mais de 1 km do centro da Costa da Caparica.Perfeito para quem quer morar numa zona exclusiva, tranquila, sem a confusão da cidade, poderá encontrar a 5 min. a pé as magnificas praias de São João da Caparica, eleitas no top 5 das melhores praias urbanas do mundo, com o seu extenso areal, ideais para o surf, encontra-se perto de supermercados, parque infantil, cafés, campos de ténis, e ciclovia.Apartamentos T2+1, T3 e T3+3 Duplex, com excelentes áreas e acabamentos de grande qualidade, cozinhas totalmente...;A+;http://www.remax.pt/120511154-10;38.662306;-9.240107;3;1;;;2013;120;2;4;1º Andar;100,00;5;
Apartamentos NOVOS;270.000 €;Fantásticos apartamentos a estrear em zona central e de referência, excelente localização, muita luminusidade, acabamentos de luxo.Materiais escolhidos com todo o detalhe e requinte. Vidros duplos com protecção térmica, estores elétricos de laminas de aluminio, pavimentos em Sucupira envernizada, painéis solares, aspiração central, alarme de tecnologia wireless, ar condicionado(solução por condutas).2 lugares de parqueamento, arrecadação.Venha conhecer, óptimos preços! ;A+;http://www.remax.pt/Condo-Apartment-For-Sale-Parede-Cascais_122911114-75;38.696805;-9.2991;3;;;144,00;2012;144;;4;4º Andar;;;
FINANCIAMENTO 100% SPREAD 1%;170.000 €;Moradia T3 com linhas arquitectónicas modernas, em condomínio privado com piscina, composto por 9 fogos. Painel solar, estores eléctricos, ar-condicionado e pré-instalação para aspiração central. 2 lugares de garagem, com acesso directo à moradia. Logradouro com acesso directo à piscina.Perto dos serviços. Zona sossegada. A poucos minutos da praia.;A+;http://www.remax.pt/Two-Family-House-For-Sale-Ferreiras-Albufeira_122371014-270;37.126039;-8.231936;3;;;;2011;178;3;4;;;;
